Bus 003 Device 002: ID 1130:660c Tenx Technology, Inc. 
Device Descriptor:
  bLength                18
  bDescriptorType         1
  bcdUSB               1.10
  bDeviceClass            0 (Defined at Interface level)
  bDeviceSubClass         0 
  bDeviceProtocol         0 
  bMaxPacketSize0         8
  idVendor           0x1130 Tenx Technology, Inc.
  idProduct          0x660c 
  bcdDevice            1.50
  iManufacturer           0 
  iProduct                2  PCsensor Temper
  iSerial                 0 
  bNumConfigurations      1
  Configuration Descriptor:
    bLength                 9
    bDescriptorType         2
    wTotalLength           59
    bNumInterfaces          2
    bConfigurationValue     1
    iConfiguration          0 
    bmAttributes         0x80
      (Bus Powered)
    MaxPower              100mA
    Interface Descriptor:
      bLength                 9
      bDescriptorType         4
      bInterfaceNumber        0
      bAlternateSetting       0
      bNumEndpoints           1
      bInterfaceClass         3 Human Interface Device
      bInterfaceSubClass      1 Boot Interface Subclass
      bInterfaceProtocol      1 Keyboard
      iInterface              0 
        HID Device Descriptor:
          bLength                 9
          bDescriptorType        33
          bcdHID               1.10
          bCountryCode           33 US
          bNumDescriptors         1
          bDescriptorType        34 Report
          wDescriptorLength      65
          Report Descriptor: (length is 65)
            Item(Global): Usage Page, data= [ 0x01 ] 1
                            Generic Desktop Controls
            Item(Local ): Usage, data= [ 0x06 ] 6
                            Keyboard
            Item(Main  ): Collection, data= [ 0x01 ] 1
                            Application
            Item(Global): Usage Page, data= [ 0x07 ] 7
                            Keyboard
            Item(Local ): Usage Minimum, data= [ 0xe0 ] 224
                            Control Left
            Item(Local ): Usage Maximum, data= [ 0xe7 ] 231
                            GUI Right
            Item(Global): Logical Minimum, data= [ 0x00 ] 0
            Item(Global): Logical Maximum, data= [ 0x01 ] 1
            Item(Global): Report Size, data= [ 0x01 ] 1
            Item(Global): Report Count, data= [ 0x08 ] 8
            Item(Main  ): Input, data= [ 0x02 ] 2
                            Data Variable Absolute No_Wrap Linear
                            Preferred_State No_Null_Position Non_Volatile Bitfield
            Item(Global): Report Count, data= [ 0x01 ] 1
            Item(Global): Report Size, data= [ 0x08 ] 8
            Item(Main  ): Input, data= [ 0x01 ] 1
                            Constant Array Absolute No_Wrap Linear
                            Preferred_State No_Null_Position Non_Volatile Bitfield
            Item(Global): Report Count, data= [ 0x03 ] 3
            Item(Global): Report Size, data= [ 0x01 ] 1
            Item(Global): Usage Page, data= [ 0x08 ] 8
                            LEDs
            Item(Local ): Usage Minimum, data= [ 0x01 ] 1
                            NumLock
            Item(Local ): Usage Maximum, data= [ 0x03 ] 3
                            Scroll Lock
            Item(Main  ): Output, data= [ 0x02 ] 2
                            Data Variable Absolute No_Wrap Linear
                            Preferred_State No_Null_Position Non_Volatile Bitfield
            Item(Global): Report Count, data= [ 0x05 ] 5
            Item(Global): Report Size, data= [ 0x01 ] 1
            Item(Main  ): Output, data= [ 0x01 ] 1
                            Constant Array Absolute No_Wrap Linear
                            Preferred_State No_Null_Position Non_Volatile Bitfield
            Item(Global): Report Count, data= [ 0x06 ] 6
            Item(Global): Report Size, data= [ 0x08 ] 8
            Item(Global): Logical Minimum, data= [ 0x00 ] 0
            Item(Global): Logical Maximum, data= [ 0xff 0x00 ] 255
            Item(Global): Usage Page, data= [ 0x07 ] 7
                            Keyboard
            Item(Local ): Usage Minimum, data= [ 0x00 ] 0
                            No Event
            Item(Local ): Usage Maximum, data= [ 0xff 0x00 ] 255
                            (null)
            Item(Main  ): Input, data= [ 0x00 ] 0
                            Data Array Absolute No_Wrap Linear
                            Preferred_State No_Null_Position Non_Volatile Bitfield
            Item(Main  ): End Collection, data=none
      Endpoint Descriptor:
        bLength                 7
        bDescriptorType         5
        bEndpointAddress     0x81  EP 1 IN
        bmAttributes            3
          Transfer Type            Interrupt
          Synch Type               None
          Usage Type               Data
        wMaxPacketSize     0x0008  1x 8 bytes
        bInterval              10
    Interface Descriptor:
      bLength                 9
      bDescriptorType         4
      bInterfaceNumber        1
      bAlternateSetting       0
      bNumEndpoints           1
      bInterfaceClass         3 Human Interface Device
      bInterfaceSubClass      0 No Subclass
      bInterfaceProtocol      0 None
      iInterface              0 
        HID Device Descriptor:
          bLength                 9
          bDescriptorType        33
          bcdHID               1.10
          bCountryCode           33 US
          bNumDescriptors         1
          bDescriptorType        34 Report
          wDescriptorLength      42
          Report Descriptor: (length is 42)
            Item(Global): Usage Page, data= [ 0x01 ] 1
                            Generic Desktop Controls
            Item(Local ): Usage, data= [ 0x03 ] 3
                            (null)
            Item(Main  ): Collection, data= [ 0x01 ] 1
                            Application
            Item(Global): Report Count, data= [ 0x20 ] 32
            Item(Global): Report Size, data= [ 0x08 ] 8
            Item(Global): Logical Minimum, data= [ 0x00 ] 0
            Item(Global): Logical Maximum, data= [ 0xff 0x00 ] 255
            Item(Global): Usage Page, data= [ 0x07 ] 7
                            Keyboard
            Item(Local ): Usage Minimum, data= [ 0x00 ] 0
                            No Event
            Item(Local ): Usage Maximum, data= [ 0xff 0x00 ] 255
                            (null)
            Item(Main  ): Feature, data= [ 0x00 ] 0
                            Data Array Absolute No_Wrap Linear
                            Preferred_State No_Null_Position Non_Volatile Bitfield
            Item(Global): Logical Minimum, data= [ 0x00 ] 0
            Item(Global): Logical Maximum, data= [ 0x01 ] 1
            Item(Global): Report Count, data= [ 0x00 0x01 ] 256
            Item(Global): Report Size, data= [ 0x01 ] 1
            Item(Global): Usage Page, data= [ 0x08 ] 8
                            LEDs
            Item(Local ): Usage Minimum, data= [ 0x01 ] 1
                            NumLock
            Item(Local ): Usage Maximum, data= [ 0x80 ] 128
                            (null)
            Item(Main  ): Output, data= [ 0x02 ] 2
                            Data Variable Absolute No_Wrap Linear
                            Preferred_State No_Null_Position Non_Volatile Bitfield
            Item(Main  ): End Collection, data=none
      Endpoint Descriptor:
        bLength                 7
        bDescriptorType         5
        bEndpointAddress     0x82  EP 2 IN
        bmAttributes            3
          Transfer Type            Interrupt
          Synch Type               None
          Usage Type               Data
        wMaxPacketSize     0x0008  1x 8 bytes
        bInterval              10
Device Status:     0x0000
  (Bus Powered)
